{
  "$schema": "https://json-schema.org/draft/2020-12/schema",
  "$id": "https://fabio-ara.github.io/AraLearn/authoring/schemas/run.schema.json",
  "title": "Execução de autoria AraLearn",
  "type": "object",
  "required": ["artifact", "version", "runId", "destination", "state", "title", "createdAt", "updatedAt"],
  "properties": {
    "artifact": { "const": "aralearn.authoring-run" },
    "version": { "const": 1 },
    "runId": { "$ref": "common.schema.json#/$defs/uuid" },
    "destination": {
      "const": "catalog"
    },
    "state": {
      "enum": ["planning", "building", "auditing", "repair", "rebuild", "ready_for_validation", "validated", "publishing", "published", "blocked", "cancelled"]
    },
    "resumeState": {
      "enum": ["planning", "building", "auditing", "repair", "rebuild", "ready_for_validation", "validated", "publishing"]
    },
    "title": {
      "type": "string",
      "minLength": 1,
      "maxLength": 240
    },
    "courseContractKey": { "$ref": "common.schema.json#/$defs/identifier" },
    "currentPartKey": { "$ref": "common.schema.json#/$defs/partKey" },
    "publishedCourseId": { "$ref": "common.schema.json#/$defs/uuid" },
    "createdAt": { "$ref": "common.schema.json#/$defs/timestamp" },
    "updatedAt": { "$ref": "common.schema.json#/$defs/timestamp" }
  },
  "allOf": [
    {
      "if": {
        "properties": { "state": { "const": "blocked" } },
        "required": ["state"]
      },
      "then": { "required": ["resumeState"] }
    },
    {
      "if": {
        "properties": { "state": { "const": "published" } },
        "required": ["state"]
      },
      "then": { "required": ["publishedCourseId"] }
    }
  ],
  "additionalProperties": false
}
