{
  "artifact": "aralearn.authoring-run",
  "version": 1,
  "runId": "11111111-1111-4111-8111-111111111111",
  "destination": "catalog",
  "state": "published",
  "title": "Fundamentos de lógica proposicional",
  "courseContractKey": "course-logica-exemplo",
  "publishedCourseId": "77777777-7777-4777-8777-777777777777",
  "createdAt": "2026-07-21T12:00:00.000Z",
  "updatedAt": "2026-07-21T12:14:00.000Z"
}
