{
  "artifact": "aralearn.authoring-run",
  "version": 1,
  "runId": "11111111-1111-4111-8111-111111111111",
  "destination": "catalog",
  "state": "planning",
  "title": "Conjunção lógica",
  "courseContractKey": "course-logica-exemplo",
  "createdAt": "2026-07-21T12:00:00.000Z",
  "updatedAt": "2026-07-21T12:01:00.000Z"
}
